id	commit	parent	val_loss	status	idea	checkpoint	note
baseline	e383d96	-	3.2354	keep	combined_keeps	bla_gpt/logs/combined_keeps_full_5100_0/state_step005100.pt	5100-step full-training baseline
F72	84fb3dc	e383d96	3.2372	discard	tapered_mlp_cosine_1.5_to_0.5	bla_gpt/logs/ar_full_F72_0/state_step005100.pt	Full 5100-step run; +0.0018 vs 3.2354 baseline; no confirmation because not lower
F73	b495754	e383d96	3.3286	discard	aurora_optimizer	bla_gpt/logs/ar_full_F73_0/state_step005100.pt	Full 5100-step run; +0.0932 vs 3.2354 baseline; no confirmation because not lower
F74	212fca1	e383d96	3.2352	keep_confirmed	goat_per_head_key0_sink_prior	bla_gpt/logs/ar_full_F74_0/state_step005100.pt	Confirmed by F74c=3.2298; both beat 3.2354 baseline; primary improvement -0.0002
F74c	7538494	F74	3.2298	confirm_keep	goat_per_head_key0_sink_prior	bla_gpt/logs/ar_full_F74c_0/state_step005100.pt	Mandatory independent full confirmation from random init; -0.0056 vs baseline
F76	fbdb605	F74c	3.2405	discard	pre_affine_rmsnorm	bla_gpt/logs/ar_full_F76_0/state_step005100.pt	Full 5100-step run; +0.0107 vs confirmed best 3.2298; no confirmation because not lower
F77	6acdbc1	F74c	3.2230	keep	gated_norm_rank16	bla_gpt/logs/ar_full_F77_0/state_step005100.pt	Full 5100-step run; -0.0068 vs confirmed best F74c=3.2298; clean keep, no confirmation required because improvement >=0.003
F78	bef34ef	F77	3.2299	discard	pope_positional_embedding	bla_gpt/logs/ar_full_F78_0/state_step005100.pt	Full 5100-step run; +0.0069 vs best F77=3.2230; no confirmation because not lower
F79	ff3e595	F77	3.2257	discard	goat_relative_spectral_prior	bla_gpt/logs/ar_full_F79_0/state_step005100.pt	Full 5100-step run; +0.0027 vs best F77=3.223; no confirmation because not lower
F80	30dfa0e	F77	3.2785	discard	nag_residual	bla_gpt/logs/ar_full_F80_0/state_step005100.pt	Full 5100-step run; +0.0555 vs best F77=3.223; no confirmation because not lower
F82	9f83128	F77	3.2224	discard_unconfirmed (F87c2=3.1987 > F87=3.1979, seed variance)	hybrid_norm	bla_gpt/logs/ar_full_F82_0/state_step005100.pt	Full 5100-step run; -0.0006 vs best F77=3.223; improvement <0.003, requires one full confirmation from random init
F82F84	fffafc9	F82	3.2128	keep	hybrid_norm_composable_gated_attn	bla_gpt/logs/ar_full_F82F84_0/state_step005100.pt	Full 5100-step run; -0.0096 vs best F82=3.2224; clean keep, no confirmation required because improvement >=0.003
F85	2503f97	F82F84	3.2011	keep	value_residual_learnable_plus	bla_gpt/logs/ar_full_F85_0/state_step005100.pt	Full 5100-step run; -0.0117 vs best F82F84=3.2128; clean keep, no confirmation required because improvement >=0.003
F86	f369535	F85	3.2042	discard	affine_scaled_attention	bla_gpt/logs/ar_full_F86_0/state_step005100.pt	Full 5100-step run; +0.0031 vs best F85=3.2011; no confirmation because not lower
F87	2bcd358	F85	3.1979	keep	unet_long_skips	bla_gpt/logs/ar_full_F87_0/state_step005100.pt	Full 5100-step run; -0.0032 vs best F85=3.2011; clean keep, no confirmation required because improvement >=0.003
F87c	dcc103d	F87	3.1961	discard_unconfirmed (F87c2=3.1987 > F87=3.1979, seed variance)	aggregate_all_winning_changes_confirmation	bla_gpt/logs/ar_full_F87c_0/state_step005100.pt	Full 5100-step run; -0.0018 vs best F87=3.1979; improvement <0.003, requires one full confirmation from random init
F88	b32104a	F87c	nan	failed_nan	oasis_depth_softmax1	bla_gpt/logs/ar_full_F88_0/best_model_3375.pt	Run stopped after persistent NaNs: first train_loss:nan at step 3489; last finite eval step 3375 val_loss 3.3480; no best_config update
F89	f4cf3c1	F87c	3.2024	discard	block_attn_res_bs2	bla_gpt/logs/ar_full_F89_0/state_step005100.pt	Full 5100-step run; +0.0063 vs best F87c=3.1961; no confirmation because not lower
F87c2	db12ea7	F87c	3.1987	discard_confirmation_failed	confirmation_run_aggregate	bla_gpt/logs/ar_full_F87c2_0/state_step005100.pt	Full 5100-step confirmation run of F87c aggregate (fresh init). Did NOT confirm: 3.1987 > F87=3.1979 > F87c=3.1961. F87c improvement was seed variance, not real. F87c downgraded to discard.
F90	7a1d9e2	F87	3.2014	discard_noop_config	learning_rate_x1.4	bla_gpt/logs/ar_full_F90_0/state_step005100.pt	Full 5100-step run; 3.2014 vs F87=3.1979 and F87c=3.1961. Intended learning_rate=0.0014 was not applied by existing config plumbing (logged peak lr 0.001), so this is a no-op baseline run, not a valid LR sweep. Peak memory 58632 MiB; step_avg 492.86ms.
F90r	d39746b	F87	3.1972	keep_confirmed	learning_rate_x1.4_valid	bla_gpt/logs/ar_full_F90r_0/state_step005100.pt	Valid LR x1.4 run after train.py JSON Hyperparameters override fix; learning_rate=0.0014 applied/logged. Beats F87=3.1979 by 0.0007 but margin is tiny, so pending confirmation. Peak memory 58632 MiB; step_avg 491.05ms.
F90r2	36699c6	F90r	3.1965	confirm_keep	learning_rate_x1.4_confirmation	bla_gpt/logs/ar_full_F90r2_0/state_step005100.pt	Independent full 5100-step confirmation from random init; confirms learning_rate=0.0014 improvement: F90r2=3.1965 and F90r=3.1972 both beat F87=3.1979; promoted as trusted best
F99	8dc7486	F90r2	3.1603	keep	aurora_lr0.03_on_best_stack	bla_gpt/logs/ar_full_F99_0/state_step005100.pt	Full 5100-step run; -0.0362 vs best F90r2=3.1965; clean keep, no confirmation required because improvement >=0.003
F94	0af8e22	F90r2	3.1897	keep	grape_a_qgate_pos_encoding	bla_gpt/logs/ar_full_F94_0/state_step005100.pt	Full 5100-step run; -0.0068 vs best F90r2=3.1965; clean keep, no confirmation required because improvement >=0.003
F92-lost	-	F92-lineage	3.1925	keep_unverified	moa_primer	-	Run artifacts were lost before upload; result recovered from run notes; no commit/checkpoint. Ran on the F92-lineage stack, distinct from this repo's F94 (GRAPE).
F93-lost	-	F92-lineage	3.2533	discard_unverified	nag_residual	-	Run artifacts were lost before upload; result recovered from run notes; no commit/checkpoint. Ran on the F92-lineage stack, distinct from this repo's F94 (GRAPE).
F94-lost	-	F92-lineage	3.3265	discard_unverified	hourglass_ffn	-	Run artifacts were lost before upload; result recovered from run notes; no commit/checkpoint. Ran on the F92-lineage stack, distinct from this repo's F94 (GRAPE).
F95-lost	-	F92-lineage	3.1572	keep_unverified	aurora_optimizer_lr0.05	-	Run artifacts were lost before upload; result recovered from run notes; no commit/checkpoint. Ran on the F92-lineage stack, distinct from this repo's F94 (GRAPE).
F96-lost	-	F92-lineage	3.1460	keep_unverified	aurora_optimizer_lr0.03	-	Run artifacts were lost before upload; result recovered from run notes; no commit/checkpoint. Ran on the F92-lineage stack, distinct from this repo's F94 (GRAPE).
F97-lost	-	F92-lineage	3.1464	discard_unverified_plateau	aurora_optimizer_lr0.02	-	Run artifacts were lost before upload; result recovered from run notes; no commit/checkpoint. Ran on the F92-lineage stack, distinct from this repo's F94 (GRAPE).
F98-lost	-	F92-lineage	3.1823	discard_unverified	nag_on_aurora	-	Run artifacts were lost before upload; result recovered from run notes; no commit/checkpoint. Ran on the F92-lineage stack, distinct from this repo's F94 (GRAPE).
F100a	ea8784f	F99	3.1677	discard	aurora_rms_match_lr0.003	bla_gpt/logs/ar_full_F100a_0/state_step005100.pt	Full 5100-step run; +0.0074 vs best F99=3.1603; no confirmation because not lower
F100b	ea8784f	F99	3.1684	discard	aurora_rms_match_lr0.005	bla_gpt/logs/ar_full_F100b_0/state_step005100.pt	Full 5100-step run; +0.0081 vs best F99=3.1603; no confirmation because not lower
F100c	f1ad8ed	F99	3.1790	discard	aurora_rms_match_lr0.01	bla_gpt/logs/ar_full_F100c_0/state_step005100.pt	Full 5100-step run; +0.0187 vs best F99=3.1603; no confirmation because not lower
F101	f1ad8ed	F99	3.1998	discard	muon_true_wd0_audit	bla_gpt/logs/ar_full_F101_0/state_step005100.pt	Full 5100-step run; +0.0395 vs best F99=3.1603; no confirmation because not lower
E2a	142e376	F99	3.1578	keep_pending_confirmation	engram_mult20	bla_gpt/logs/ar_full_E2a_0/state_step005100.pt	Full 5100-step run; -0.0025 vs best F99=3.1603; improvement <0.003, requires one full confirmation from random init
E1a	142e376	F99	3.2118	discard	lr_floor_0.3	bla_gpt/logs/ar_full_E1a_0/state_step005100.pt	Full 5100-step run; +0.0515 vs best F99=3.1603; no confirmation because not lower
E1b	3a2c0f7	F99	3.1664	discard	lr_floor_0.3_ema300	bla_gpt/logs/ar_full_E1b_0/state_step005100.pt	Full 5100-step run; +0.0061 vs best F99=3.1603; no confirmation because not lower
E1c	3a2c0f7	F99	3.1487	keep	lr_floor_0.15_ema300	bla_gpt/logs/ar_full_E1c_0/state_step005100.pt	Full 5100-step run; -0.0116 vs best F99=3.1603; clean keep, no confirmation required because improvement >=0.003
E3	3a2c0f7	F99	3.1564	keep	engram_normalize_tokens	bla_gpt/logs/ar_full_E3_0/state_step005100.pt	Full 5100-step run; -0.0039 vs best F99=3.1603; clean keep, no confirmation required because improvement >=0.003. Token-normalization before n-gram hash (PR #375 style), config flag engram_normalize_tokens=true, MinimalEngram variant. Note: parallel branch E1c (same F99 parent) recorded 3.1487, a larger improvement; this result does not update the global best but is a valid clean keep for this technique alone.
E2a_confirm	62d74b4	F99	3.1446	keep	engram_mult20_confirm	bla_gpt/logs/ar_full_E2a_confirm_0/state_step005100.pt	Full 5100-step run; -0.0041 vs best E1c=3.1487; clean keep, no confirmation required because improvement >=0.003
E4a	2ba8109	E1c	3.1606	discard	aurora_twin_rail_momentum	bla_gpt/logs/ar_full_E4a_0/state_step005100.pt	Full 5100-step run; +0.0119 vs best E1c=3.1487; no confirmation because not lower. ANVIL2-inspired twin-rail slow momentum (rail_slow_beta=0.98, rail_engage_step=514, rail_fast_weight=0.4385) added to Aurora, config-gated aurora_twin_rail=true default off. E4b (full ANVIL2 cascade) skipped per protocol: E4a did not show a gain.
E2b	c839b2e	F99	3.1558	discard	engram_mult50	bla_gpt/logs/ar_full_E2b_0/state_step005100.pt	Full 5100-step run; +0.0112 vs best E2a_confirm=3.1446; no confirmation because not lower
E5	04578fb	F99	3.1516	discard	engram_mult20_muddformer_mix	bla_gpt/logs/ar_full_E5_0/state_step005100.pt	Full 5100-step run; +0.0070 vs best E2a_confirm=3.1446; no confirmation because not lower
B0	da1363a	F99	3.1265	keep	seeded_base_engram20_seed1337	bla_gpt/logs/ar_full_B0_0/state_step005100.pt	Full 5100-step run; -0.0181 vs best E2a_confirm=3.1446; clean keep, no confirmation required because improvement >=0.003
C1	2b8b144	B0	3.1280	discard	b0_lrfloor0.15_ema300	bla_gpt/logs/ar_full_C1_0/state_step005100.pt	Full 5100-step run; +0.0015 vs best B0=3.1265; no confirmation because not lower
B0s2	a0f9e71	B0	3.1241	keep_pending_confirmation	b0_seed2_repeat	bla_gpt/logs/ar_full_B0s2_0/state_step005100.pt	Full 5100-step run; -0.0024 vs best B0=3.1265; improvement <0.003, requires one full confirmation from random init
E6a	542d458	B0	3.1241	keep_pending_confirmation	mhar_heads4	bla_gpt/logs/ar_full_E6a_0/state_step005100.pt	Full 5100-step run; -0.0024 vs best B0_seed1337=3.1265; improvement <0.003, requires one full confirmation from random init
E6b	b88289b	B0	3.1238	keep_pending_confirmation	mhar_heads8	bla_gpt/logs/ar_full_E6b_0/state_step005100.pt	Full 5100-step run; -0.0027 vs best B0_seed1337=3.1265; improvement <0.003, requires one full confirmation from random init
E7a	7e505a9	B0	3.1134	keep	rotary_without_RoVE	bla_gpt/logs/ar_full_E7a_0/state_step005100.pt	Full 5100-step run; -0.0131 vs best B0=3.1265; clean keep, no confirmation required because improvement >=0.003
E7b	7f91222	E7a	3.1106	keep_pending_confirmation	RoVE_on_rotary	bla_gpt/logs/ar_full_E7b_0/state_step005100.pt	Full 5100-step run; -0.0028 vs best E7a=3.1134; improvement <0.003, requires one full confirmation from random init
E7c	b17f3cc	B0	3.1262	keep_pending_confirmation	GRAPE_RoVE	bla_gpt/logs/ar_full_E7c_0/state_step005100.pt	Full 5100-step run; -0.0003 vs best B0_seed1337=3.1265; improvement <0.003, requires one full confirmation from random init
E6b_s2	7a22d3d	B0s2	3.1203	keep	mhar_heads8_seed2	bla_gpt/logs/ar_full_E6b_s2_0/state_step005100.pt	Full 5100-step run; -0.0038 vs best B0_seed2=3.1241; clean keep, no confirmation required because improvement >=0.003
E7a_s2	74b8290	B0s2	3.1250	discard	rotary_without_RoVE_seed2	bla_gpt/logs/ar_full_E7a_s2_0/state_step005100.pt	Full 5100-step run; +0.0009 vs best B0_seed2=3.1241; no confirmation because not lower
E7b_s2	7949e52	E7a_s2	3.1240	keep_pending_confirmation	rotary_rove_seed2	bla_gpt/logs/ar_full_E7b_s2_0/state_step005100.pt	Full 5100-step run; -0.0010 vs best E7a_s2=3.125; improvement <0.003, requires one full confirmation from random init
Combined	75edd62	E7b	3.1113	discard	rotary_rove_mhar_heads8	bla_gpt/logs/ar_full_Combined_0/state_step005100.pt	Full 5100-step run; +0.0007 vs best E7b_seed1337=3.1106; no confirmation because not lower
